{"$id":"/schemas/AdapterConformance.schema.json","$schema":"https://json-schema.org/draft/2020-12/schema","additionalProperties":false,"title":"AdapterConformance","type":"object","required":["schemaVersion","version","id","adapter","scenarios"],"properties":{"schemaVersion":{"type":"string","pattern":"^\\d+\\.\\d+\\.\\d+$"},"version":{"type":"string","pattern":"^\\d+\\.\\d+\\.\\d+$"},"id":{"type":"string"},"adapter":{"$ref":"./HarnessAdapter.schema.json"},"scenarios":{"type":"array","minItems":1,"items":{"$ref":"#/$defs/Scenario"}}},"$defs":{"Scenario":{"oneOf":[{"$ref":"#/$defs/HandoffRoundtripScenario"},{"$ref":"#/$defs/CheckpointResumeScenario"}]},"HandoffRoundtripScenario":{"additionalProperties":false,"type":"object","required":["kind","canonicalInput","appliedMapping","mappedOutput","restoredCanonical","semanticDigest"],"properties":{"kind":{"const":"handoff-roundtrip"},"canonicalInput":{"type":"object"},"appliedMapping":{"type":"array","items":{"$ref":"./HarnessAdapter.schema.json#/$defs/FieldMapping"}},"mappedOutput":{"type":"object"},"restoredCanonical":{"type":"object"},"semanticDigest":{"type":"string","pattern":"^[0-9a-f]{64}$"}}},"CheckpointResumeScenario":{"additionalProperties":false,"type":"object","required":["kind","adapterId","checkpointEnvelope","resumeToken","evidence","repoRevision","compatibility"],"properties":{"kind":{"const":"checkpoint-resume"},"adapterId":{"type":"string"},"checkpointEnvelope":{"$ref":"./CheckpointEnvelope.schema.json"},"resumeToken":{"$ref":"./ResumeToken.schema.json"},"evidence":{"type":"array","minItems":1,"items":{"$ref":"./EvidenceReference.schema.json"}},"repoRevision":{"type":"string"},"compatibility":{"additionalProperties":false,"type":"object","required":["version"],"properties":{"version":{"type":"string","pattern":"^\\d+\\.\\d+\\.\\d+$"}}},"resumeRequested":{"type":"boolean"}}}}}
